{
  "$schema": "http://json-schema.org/draft-07/schema#",
  "type": "array",
  "items": {
    "type": "object",
    "required": ["code", "name", "fields"],
    "additionalProperties": false,
    "properties": {
      "code": { "type": "string", "pattern": "^[a-z][a-z0-9_]*$" },
      "name": { "type": "string", "minLength": 1 },
      "notify_admin": { "type": "boolean" },
      "notify_user_field": { "type": "string" },
      "fields": {
        "type": "array",
        "items": {
          "type": "object",
          "required": ["name", "type", "required"],
          "additionalProperties": false,
          "properties": {
            "name": { "type": "string", "pattern": "^[a-z][a-z0-9_]*$" },
            "type": {
              "type": "string",
              "enum": ["string", "text", "email", "phone", "integer", "choice"]
            },
            "required": { "type": "boolean" },
            "min": { "type": "integer" },
            "max": { "type": "integer" },
            "choices": {
              "type": "array",
              "items": { "type": "string" }
            }
          }
        }
      }
    }
  }
}
